{
  "$schema": "https://json-schema.org/draft/2020-12/schema",
  "$id": "https://cuttoon-copilot.local/spec/storyboard.schema.json",
  "title": "Storyboard",
  "description": "세션(컷툰 한 편) 단위 확정값. preset.schema.json이 명시적으로 storyboard 소유라 규정한 것만 담는다 — 등장 캐릭터(누가 preset.assets.character_sheet 풀에서 나오는지), 서사 전개, 소재, 대사, 컷별 연출. preset처럼 DB 행 자체의 id·생성시각은 스키마에 넣지 않고 저장소 컬럼이 담당한다(예: Supabase sessions 테이블의 id/created_at). 4컷 고정, vocabulary.json의 값 집합을 그대로 재사용한다.",
  "type": "object",
  "required": ["storyboard_version", "subject", "cast", "cuts"],
  "additionalProperties": false,
  "properties": {
    "storyboard_version": {
      "type": "string",
      "enum": ["1.0"]
    },
    "subject": {
      "type": "string",
      "minLength": 1,
      "description": "이 컷툰 한 편의 실제 소재 한 줄. preset.context.main_subjects는 프로젝트가 반복해서 다루는 주제군일 뿐이고, 실제 소재는 여기서 받는다 (preset.schema.json 주석 원문)"
    },
    "cast": {
      "type": "array",
      "minItems": 1,
      "maxItems": 2,
      "description": "타협 불가: 등장 캐릭터 1~2명, 그중 주인공(protagonist) 정확히 1명 (contains). preset.schema.json이 세션 단위이므로 storyboard에서 강제라고 명시한 제약이다. 서버 저장 검사(storyboardContractProblems)가 강제한다.",
      "items": { "$ref": "#/$defs/castMember" },
      "contains": { "properties": { "role": { "const": "protagonist" } } },
      "minContains": 1,
      "maxContains": 1
    },
    "cuts": {
      "type": "array",
      "minItems": 4,
      "maxItems": 4,
      "description": "4컷 고정. narrative_beat는 vocabulary.json의 10개 태그 중 자유롭게 골라 이 컷툰만의 흐름을 짠다 (기승전결처럼 고정된 4단계 순서를 강제하지 않음). cta 비트 개수는 cta_strength에 따라 최상위 allOf가 정한다 — none이면 0개, 그 외(없음 포함, clear로 해석)면 정확히 1개. cut_index 유일성(1~4 각 1회)은 스키마가 아니라 storyboard-guard.ts의 런타임 체크로 강제한다 — 배열 요소가 객체라 uniqueItems로 못 잡음.",
      "items": { "$ref": "#/$defs/cut" }
    },
    "cta_strength": {
      "type": "string",
      "enum": ["none", "soft", "clear"],
      "description": "이 컷툰 한 편의 CTA 강도 (issue #205). 없으면 clear로 해석해 기존 스토리보드(필드 없음)가 그대로 유효하다."
    },
    "subject_tags": {
      "type": "array",
      "maxItems": 3,
      "description": "소재 [태그]의 저장 매핑 (issue #206). 없으면 기존 세션 그대로 유효(cta_strength 없음과 같은 원칙). subject는 원문(괄호 포함) 그대로 둔다. 형식 계약만. subject와의 순서·중복 대응은 보장하지 않으며 읽는 쪽은 subject를 다시 파싱해 category만 순서대로 쓴다(원문 누출 없음).",
      "items": {
        "type": "object",
        "required": ["raw", "category"],
        "additionalProperties": false,
        "properties": {
          "raw": {
            "type": "string",
            "minLength": 1,
            "maxLength": 30,
            "description": "괄호 안 원문(30자 절단, 저장·표시용). 길이는 유니코드 코드포인트 기준(JSON Schema maxLength와 같음, 사용자가 보는 글자 수와 다를 수 있음)."
          },
          "category": {
            "type": "string",
            "minLength": 1,
            "description": "고유명사 없는 한국어 카테고리 명사구(예: 운동 앱). 저장 시 필수(trim 후 비어 있지 않음). 읽는 쪽은 형태가 어긋나면 제품으로 해석한다."
          }
        }
      }
    },
    "reference_image": {
      "anyOf": [
        { "type": "null" },
        { "type": "string", "pattern": "^asset://.+" },
        { "type": "string", "pattern": "^/demo-cache/.+" }
      ],
      "description": "POC 한정(#326, main 반영 아님). 표지=레퍼런스 컷 결정에 따라 확정된 레퍼런스 컷 asset. generated_image와 같은 형식 규칙. 없으면 기존 세션 그대로 유효."
    }
  },
  "allOf": [
    {
      "if": { "required": ["cta_strength"], "properties": { "cta_strength": { "const": "none" } } },
      "then": {
        "properties": {
          "cuts": {
            "not": { "contains": { "properties": { "narrative_beat": { "const": "cta" } } } }
          }
        }
      },
      "else": {
        "properties": {
          "cuts": {
            "contains": { "properties": { "narrative_beat": { "const": "cta" } } },
            "minContains": 1,
            "maxContains": 1
          }
        }
      },
      "description": "cta_strength가 none이면 cta 비트 0개, 그 외(없음 포함)면 정확히 1개. cta 비트의 위치(4번 고정)는 $defs.cut.allOf가 정한다."
    }
  ],
  "$defs": {
    "castMember": {
      "type": "object",
      "required": ["character_id", "role"],
      "additionalProperties": false,
      "properties": {
        "character_id": {
          "type": "string",
          "minLength": 1,
          "description": "이 인물을 가리키는 라벨. chictimin 확인 결과 preset.assets.character_sheet는 고정 마스코트(지도사) 한 명만 담고, 주인공·어르신 등 나머지 인물은 고정 시트가 없는 가변 인물(세션마다 새로 생성)이라 character_sheet를 참조할 필요가 없다 — role=supporting이 지도사를 가리킬 때만 character_sheet와 연결된다고 보면 된다. 주의(issue #113·#123): 이 규약을 실제 조립 코드가 지키지 않는다 — app/(studio)/session/[id]/storyboard-assembly.ts 가 넣는 role=supporting 은 브레인스토밍에서 사용자가 자유 입력한 조연이고 지도사가 아니다. 즉 현재 파이프라인의 cast 에는 마스코트가 없다. 이 서술을 계약으로 읽고 코드를 붙이면 어긋난다. buildSessionCast(lib/llm/session-cast.ts)가 연결되는 #123 이후에 규약과 코드가 일치한다. cuts[].characters_in_frame의 character_id도 여기 나온 값과 일치해야 한다(스키마로는 강제 못 함, 리뷰 시 수동 확인 필요)."
        },
        "role": {
          "type": "string",
          "enum": ["protagonist", "supporting"]
        },
        "description": {
          "type": "string",
          "description": "이 세션에서 이 캐릭터가 맡은 배역 설명 (예: '무릎이 아픈 어머니')"
        }
      }
    },
    "cut": {
      "type": "object",
      "required": ["cut_index", "narrative_beat", "shot_type", "camera_angle", "characters_in_frame", "caption"],
      "additionalProperties": false,
      "properties": {
        "cut_index": { "type": "integer", "minimum": 1, "maximum": 4 },
        "narrative_beat": {
          "type": "string",
          "enum": ["hook", "problem", "solution", "cta", "question", "fact", "benefit", "before", "turning", "after"]
        },
        "shot_type": {
          "type": "string",
          "enum": ["closeup", "bust", "waist", "full", "wide"]
        },
        "camera_angle": {
          "type": "string",
          "enum": ["eye", "high", "low"]
        },
        "time_of_day": {
          "type": "string",
          "enum": ["morning", "noon", "evening", "night"]
        },
        "characters_in_frame": {
          "type": "array",
          "minItems": 0,
          "maxItems": 2,
          "description": "cast 중 이 컷에 실제로 등장하는 인물. character_id는 cast[].character_id 중 하나와 일치해야 한다. 배열 순서는 인물의 표시 순서를 정하며, 순서·구성 변경은 컷 다시 뽑기(그림 재생성)로만 한다. POC S10에서 인물 0명 허용(빈 배열) — 그 컷은 배경·소품 중심 그림이 된다.",
          "items": {
            "type": "object",
            "required": ["character_id", "expression", "pose"],
            "additionalProperties": false,
            "properties": {
              "character_id": { "type": "string" },
              "expression": {
                "type": "string",
                "enum": ["neutral", "smile", "laugh", "tired", "worried", "surprised", "determined", "relieved"]
              },
              "pose": {
                "type": "string",
                "enum": ["stand", "sit", "slump", "point", "arms_up", "walk", "stretch", "lie_down"]
              }
            }
          }
        },
        "caption": {
          "type": "object",
          "required": ["text", "bubble_type", "position"],
          "additionalProperties": false,
          "description": "그림 위에 나중에 얹는 대사. 이미지 생성 프롬프트엔 절대 포함하지 않는다 — 캡션 수정 시 이미지 재생성이 필요 없어야 하기 때문.",
          "properties": {
            "text": { "type": "string" },
            "bubble_type": {
              "type": "string",
              "enum": ["rounded", "rect", "cloud"],
              "description": "기본은 preset.style.bubble_style을 따르되, 이 컷만 다르게 쓰고 싶으면 덮어쓴다"
            },
            "position": {
              "type": "string",
              "enum": ["top_left", "top_right", "bottom_left", "bottom_right", "center"]
            },
            "speaker_index": {
              "type": "integer",
              "enum": [0, 1],
              "description": "2인 컷에서 대사를 말하는 인물의 characters_in_frame 순번. 1인 이하 컷(인물 0명 포함)에는 두지 않는다. 대사 생성이 정하지 못하면 생략한다. 인물 구성·순서 변경은 컷 다시 뽑기(그림 재생성)로만 한다. Export는 과거·범위 밖 값을 무시하고 기본 목표점으로 그린다."
            },
            "anchor": {
              "type": "object",
              "required": ["x", "y"],
              "additionalProperties": false,
              "properties": {
                "x": { "type": "number", "minimum": 0, "maximum": 1 },
                "y": { "type": "number", "minimum": 0, "maximum": 1 }
              },
              "description": "말풍선 몸통 중심의 원본 이미지 비율 좌표(0~1, 좌상단 원점). 사용자가 드래그로 정한 값이며 Export·에디터는 보정하지 않는다(잘릴 수 있음 — 에디터가 경고한다). 없으면 position 칸 기본 위치로 그린다. 현재 에디터는 5종 스냅이며 좌표 저장·렌더는 후속 반영이다."
            }
          }
        },
        "reserved_zone": {
          "type": "string",
          "enum": ["top", "bottom", "left", "right"],
          "description": "이미지 생성 시점에 이 가장자리를 비워달라고 지시하는 값 (caption.position과는 별개 — reserved_zone은 생성 단계 지시, position은 이후 말풍선을 실제로 얹는 위치)"
        },
        "cta_override": {
          "type": ["string", "null"],
          "description": "narrative_beat=cta인 컷에서만 의미 있음. null이면 preset.rules.cta_format 기본값을 그대로 쓴다. null이 아니면 spec/data/cta_presets.json의 presets[].id 중 하나여야 한다 (preset.rules.cta_format과 동일 규약, issue #4)."
        },
        "generated_image": {
          "anyOf": [
            { "type": "null" },
            { "type": "string", "pattern": "^asset://.+" },
            { "type": "string", "pattern": "^/demo-cache/.+" }
          ],
          "description": "생성된 이미지 애셋 참조. 생성 전엔 null. 형식은 스키마가 보고 목록 일치는 서버가 본다 — 캐시 값은 manifest에 있는 것만 유효(서버 정확 일치)."
        },
        "prompt_used": {
          "type": ["string", "null"],
          "description": "실제 생성에 쓰인 프롬프트 (재생성/디버깅용). 대사 텍스트는 포함하지 않는다."
        }
      },
      "allOf": [
        {
          "if": { "properties": { "narrative_beat": { "const": "cta" } } },
          "then": { "required": ["cta_override"] },
          "else": { "properties": { "cta_override": { "const": null } } }
        },
        {
          "if": { "properties": { "characters_in_frame": { "maxItems": 1 } } },
          "then": { "properties": { "caption": { "not": { "required": ["speaker_index"] } } } },
          "description": "1인 이하 컷에는 speaker_index를 두지 않는다(화자는 2인 컷 전용)."
        },
        {
          "if": { "properties": { "narrative_beat": { "const": "cta" } } },
          "then": { "properties": { "cut_index": { "const": 4 } } },
          "description": "CTA는 서사 비트가 아니라 마지막 컷의 고정 역할이라는 게 프로젝트 전제라서(레포 문서가 CTA를 항상 '마지막 컷'으로 다룸), cta 비트가 있으면 위치를 4번으로 고정한다 (리뷰 결정, 최상위 allOf 참고 — none이면 cta 비트 자체가 없다)."
        }
      ]
    }
  }
}
